{
  "batch": 3,
  "candidates": [
    {
      "candidate_id": "cities:alexandria",
      "candidate_status": "UNVERIFIED_FOR_1900",
      "category": "cities",
      "historical_fact": false,
      "notes": "Copied from a current repository prototype; this candidate is not a 1900 historical fact and is not eligible for runtime promotion without the required evidence.",
      "required_evidence": [
        "historical_identity_and_date",
        "source_locator",
        "historical_parent_crosswalk",
        "historical_role_or_population"
      ],
      "runtime_authority": false,
      "source_index": 29,
      "source_path": "data/world_map/cities.json",
      "source_record": {
        "id": "alexandria",
        "label_priority": 72,
        "lon_lat": [
          29.9187,
          31.2001
        ],
        "major": true,
        "max_zoom": 200.0,
        "min_zoom": 1.35,
        "name": "亚历山大港",
        "object_level": "city",
        "parent_country_id": "ottoman_empire",
        "parent_region_id": ""
      },
      "source_record_id": "alexandria",
      "source_sha256": "62466f51461eaacced57a350a30e98e7824cbbd2401d367ccced6b35a60de919"
    },
    {
      "candidate_id": "cities:antwerp",
      "candidate_status": "UNVERIFIED_FOR_1900",
      "category": "cities",
      "historical_fact": false,
      "notes": "Copied from a current repository prototype; this candidate is not a 1900 historical fact and is not eligible for runtime promotion without the required evidence.",
      "required_evidence": [
        "historical_identity_and_date",
        "source_locator",
        "historical_parent_crosswalk",
        "historical_role_or_population"
      ],
      "runtime_authority": false,
      "source_index": 15,
      "source_path": "data/world_map/cities.json",
      "source_record": {
        "id": "antwerp",
        "label_priority": 88,
        "lon_lat": [
          4.4025,
          51.2194
        ],
        "major": true,
        "max_zoom": 200.0,
        "min_zoom": 1.4,
        "name": "安特卫普",
        "native_name": "Antwerpen",
        "object_level": "city",
        "parent_country_id": "country_bel",
        "parent_region_id": ""
      },
      "source_record_id": "antwerp",
      "source_sha256": "62466f51461eaacced57a350a30e98e7824cbbd2401d367ccced6b35a60de919"
    },
    {
      "candidate_id": "cities:beijing",
      "candidate_status": "UNVERIFIED_FOR_1900",
      "category": "cities",
      "historical_fact": false,
      "notes": "Copied from a current repository prototype; this candidate is not a 1900 historical fact and is not eligible for runtime promotion without the required evidence.",
      "required_evidence": [
        "historical_identity_and_date",
        "source_locator",
        "historical_parent_crosswalk",
        "historical_role_or_population"
      ],
      "runtime_authority": false,
      "source_index": 27,
      "source_path": "data/world_map/cities.json",
      "source_record": {
        "id": "beijing",
        "label_priority": 94,
        "lon_lat": [
          116.4074,
          39.9042
        ],
        "major": true,
        "max_zoom": 200.0,
        "min_zoom": 0.9,
        "name": "北京",
        "object_level": "city",
        "parent_country_id": "qing_empire",
        "parent_region_id": ""
      },
      "source_record_id": "beijing",
      "source_sha256": "62466f51461eaacced57a350a30e98e7824cbbd2401d367ccced6b35a60de919"
    },
    {
      "candidate_id": "cities:berlin",
      "candidate_status": "UNVERIFIED_FOR_1900",
      "category": "cities",
      "historical_fact": false,
      "notes": "Copied from a current repository prototype; this candidate is not a 1900 historical fact and is not eligible for runtime promotion without the required evidence.",
      "required_evidence": [
        "historical_identity_and_date",
        "source_locator",
        "historical_parent_crosswalk",
        "historical_role_or_population"
      ],
      "runtime_authority": false,
      "source_index": 20,
      "source_path": "data/world_map/cities.json",
      "source_record": {
        "id": "berlin",
        "label_priority": 94,
        "lon_lat": [
          13.405,
          52.52
        ],
        "major": true,
        "max_zoom": 200.0,
        "min_zoom": 0.85,
        "name": "柏林",
        "object_level": "city",
        "parent_country_id": "german_empire",
        "parent_region_id": ""
      },
      "source_record_id": "berlin",
      "source_sha256": "62466f51461eaacced57a350a30e98e7824cbbd2401d367ccced6b35a60de919"
    },
    {
      "candidate_id": "cities:bordeaux",
      "candidate_status": "UNVERIFIED_FOR_1900",
      "category": "cities",
      "historical_fact": false,
      "notes": "Copied from a current repository prototype; this candidate is not a 1900 historical fact and is not eligible for runtime promotion without the required evidence.",
      "required_evidence": [
        "historical_identity_and_date",
        "source_locator",
        "historical_parent_crosswalk",
        "historical_role_or_population"
      ],
      "runtime_authority": false,
      "source_index": 7,
      "source_path": "data/world_map/cities.json",
      "source_record": {
        "id": "bordeaux",
        "label_priority": 80,
        "lon_lat": [
          -0.5792,
          44.8378
        ],
        "major": true,
        "max_zoom": 200.0,
        "min_zoom": 1.75,
        "name": "波尔多",
        "object_level": "city",
        "parent_country_id": "country_fra",
        "parent_region_id": "aquitaine"
      },
      "source_record_id": "bordeaux",
      "source_sha256": "62466f51461eaacced57a350a30e98e7824cbbd2401d367ccced6b35a60de919"
    },
    {
      "candidate_id": "cities:brest",
      "candidate_status": "UNVERIFIED_FOR_1900",
      "category": "cities",
      "historical_fact": false,
      "notes": "Copied from a current repository prototype; this candidate is not a 1900 historical fact and is not eligible for runtime promotion without the required evidence.",
      "required_evidence": [
        "historical_identity_and_date",
        "source_locator",
        "historical_parent_crosswalk",
        "historical_role_or_population"
      ],
      "runtime_authority": false,
      "source_index": 5,
      "source_path": "data/world_map/cities.json",
      "source_record": {
        "id": "brest",
        "label_priority": 68,
        "lon_lat": [
          -4.4861,
          48.3904
        ],
        "major": false,
        "max_zoom": 200.0,
        "min_zoom": 6.4,
        "name": "布雷斯特",
        "object_level": "city",
        "parent_country_id": "country_fra",
        "parent_region_id": "brittany"
      },
      "source_record_id": "brest",
      "source_sha256": "62466f51461eaacced57a350a30e98e7824cbbd2401d367ccced6b35a60de919"
    },
    {
      "candidate_id": "cities:brussels",
      "candidate_status": "UNVERIFIED_FOR_1900",
      "category": "cities",
      "historical_fact": false,
      "notes": "Copied from a current repository prototype; this candidate is not a 1900 historical fact and is not eligible for runtime promotion without the required evidence.",
      "required_evidence": [
        "historical_identity_and_date",
        "source_locator",
        "historical_parent_crosswalk",
        "historical_role_or_population"
      ],
      "runtime_authority": false,
      "source_index": 14,
      "source_path": "data/world_map/cities.json",
      "source_record": {
        "id": "brussels",
        "label_priority": 94,
        "lon_lat": [
          4.3517,
          50.8503
        ],
        "major": true,
        "max_zoom": 200.0,
        "min_zoom": 0.95,
        "name": "布鲁塞尔",
        "native_name": "Bruxelles",
        "object_level": "city",
        "parent_country_id": "country_bel",
        "parent_region_id": ""
      },
      "source_record_id": "brussels",
      "source_sha256": "62466f51461eaacced57a350a30e98e7824cbbd2401d367ccced6b35a60de919"
    },
    {
      "candidate_id": "cities:buenos_aires",
      "candidate_status": "UNVERIFIED_FOR_1900",
      "category": "cities",
      "historical_fact": false,
      "notes": "Copied from a current repository prototype; this candidate is not a 1900 historical fact and is not eligible for runtime promotion without the required evidence.",
      "required_evidence": [
        "historical_identity_and_date",
        "source_locator",
        "historical_parent_crosswalk",
        "historical_role_or_population"
      ],
      "runtime_authority": false,
      "source_index": 31,
      "source_path": "data/world_map/cities.json",
      "source_record": {
        "id": "buenos_aires",
        "label_priority": 70,
        "lon_lat": [
          -58.3816,
          -34.6037
        ],
        "major": true,
        "max_zoom": 200.0,
        "min_zoom": 1.25,
        "name": "布宜诺斯艾利斯",
        "object_level": "city",
        "parent_country_id": "argentine_republic",
        "parent_region_id": ""
      },
      "source_record_id": "buenos_aires",
      "source_sha256": "62466f51461eaacced57a350a30e98e7824cbbd2401d367ccced6b35a60de919"
    },
    {
      "candidate_id": "cities:calais",
      "candidate_status": "UNVERIFIED_FOR_1900",
      "category": "cities",
      "historical_fact": false,
      "notes": "Copied from a current repository prototype; this candidate is not a 1900 historical fact and is not eligible for runtime promotion without the required evidence.",
      "required_evidence": [
        "historical_identity_and_date",
        "source_locator",
        "historical_parent_crosswalk",
        "historical_role_or_population"
      ],
      "runtime_authority": false,
      "source_index": 2,
      "source_path": "data/world_map/cities.json",
      "source_record": {
        "id": "calais",
        "label_priority": 61,
        "lon_lat": [
          1.8587,
          50.9513
        ],
        "major": false,
        "max_zoom": 200.0,